"Character","Dialog","background"
"Alex","Hi, Frank! I have this blueprint of a machine that could help the population of the Outer Planets, and to make it, I need some resources from you, like Labour and Material. I'm low on the budget now, but the best reward is to be part of something that can help others. What do you think about joining me?
","furnace-01-frank"
"Frank","Please, Alex. Helping others doesn't pay my bills. If you don't pay me, We don't have a deal.
Please, Alex. Helping others doesn't pay my bills. If you don't pay me, We don't have a deal.
","furnace-01-alex"